{
  "id": "mm-0011",
  "slug": "why-we-procrastinate",
  "canonical_url": "https://aafnaipatro.com/why-we-procrastinate/",
  "title": "Why We Procrastinate: Emotion, Habits and Time",
  "meta_description": "Understand why people procrastinate, how difficult emotions and task design contribute, and evidence-informed ways to make starting work easier.",
  "h1": "Why We Procrastinate?",
  "category": "Mind & Psychology",
  "author": "Suraj Dahal",
  "published": "2026-10-20",
  "key_takeaways": [
    "Procrastination is an unnecessary delay of an intended task despite expecting negative consequences; it is not simply the same as resting or reprioritising. [1][2]",
    "Avoiding a task can provide short-term relief from anxiety, boredom or uncertainty, which may reinforce the habit. [1]",
    "Breaking work into specific, small first actions can reduce the emotional barrier to beginning. [2][3]",
    "Self-compassion and realistic planning may help people recover from delays without adding shame that makes avoidance worse. [1][2]"
  ],
  "sections": [
    {
      "h2": "The short answer",
      "paras": [
        "People procrastinate when they put off an intended task even though they expect the delay to cause problems. Often, the task brings uncomfortable feelings: anxiety about failure, boredom, frustration, uncertainty or fear of being judged. Doing something easier offers quick relief, but the original task remains and may become more stressful as the deadline approaches. [1][2]",
        "Procrastination is not always evidence of laziness or poor character. Psychologists study it as a self-regulation problem involving how people respond to feelings, temptations and distant rewards. Understanding what makes a task hard to start is often more useful than simply telling yourself to try harder. The strategies that help depend on whether the obstacle is unclear instructions, perfectionism, distraction or low energy. [1][2]"
      ]
    },
    {
      "h2": "What procrastination means",
      "paras": [
        "Researchers distinguish procrastination from any ordinary delay. A person may sensibly postpone one task because another is urgent, because information is missing, or because rest is necessary. Procrastination is closer to an unnecessary, voluntary delay of an intended activity despite recognising that the delay may have negative consequences. That definition focuses on the decision pattern, not on whether a person is busy. [1]",
        "This distinction matters because not every postponed task needs fixing. A crowded schedule can require prioritisation, and waiting for a missing resource may be rational. The useful question is whether postponing the task serves a clear purpose or mainly avoids the uncomfortable feeling associated with starting it. If avoidance repeats even when the task matters and time is available, it may be a procrastination loop. [1][2]"
      ]
    },
    {
      "h2": "The short-term relief loop",
      "paras": [
        "Imagine opening a difficult assignment and immediately feeling worried that you will do it badly. You close the document and check messages instead. The discomfort falls for a moment, so avoidance feels rewarding. That immediate relief can teach the brain to repeat the same response the next time the assignment appears, even though the long-term cost is higher stress and less time. [1]",
        "The task itself may not be objectively unpleasant. It may be the meaning attached to it: fear of making a mistake, resentment about being told to do it, uncertainty about where to begin, or concern that the result will reveal a weakness. Research discussed by the American Psychological Association highlights this emotional side of procrastination and the role of mood repair in maintaining delay. [1][2]"
      ]
    },
    {
      "h2": "Perfectionism, uncertainty and task size",
      "paras": [
        "Perfectionism can make the first step feel risky. If a draft must be brilliant immediately, writing an imperfect opening seems like proof of failure rather than a normal part of work. Unclear tasks create a different barrier: when the next action is vague, the mind has to solve the assignment and start it at the same time. Large projects also hide the small steps needed to make progress. [2][3]",
        "These obstacles can be reduced by changing the task rather than judging the person. Define the next visible action, such as opening the document and listing three headings. Decide what a rough first version must contain, and separate drafting from editing. For an unclear task, write down the unanswered question or ask for the missing information. A task that has a concrete entry point is easier to approach. [2][3]"
      ]
    },
    {
      "h2": "Why distractions are so attractive",
      "paras": [
        "Phones, short videos and small household jobs offer clear, immediate rewards. Their stopping points are often easy to understand, while a complex project may provide no satisfying result for hours. When attention is tired or the task feels threatening, the nearby reward can win the competition. This does not mean technology alone causes procrastination; it means the environment can make avoidance easier than sustained work. [2][3]",
        "Changing the environment can reduce the number of decisions required. Put the phone out of reach, close unrelated tabs, prepare the necessary materials, and choose a short work interval. The point is not to build a perfect distraction-free life. It is to make the desired action slightly easier and the automatic detour slightly less convenient while you practise starting. [2][3]"
      ]
    },
    {
      "h2": "Practical ways to begin",
      "paras": [
        "Start by making the next action small enough to do while still feeling uncertain. Instead of promising to finish a report, commit to opening the file and writing a rough first paragraph. A brief start can create information about what the task requires and make the next step less mysterious. The goal of the first interval is to begin, not to complete the whole project. [2][3][4][5]",
        "Use a specific cue: after breakfast, sit at the desk and work on the first section for ten minutes. Break work into milestones, set a realistic deadline before the official one, and identify what counts as done. If you miss the plan, restart with the next small action instead of treating the lapse as proof that the day is ruined. Consistency is built through repeatable steps. [2][3]"
      ]
    },
    {
      "h2": "Self-compassion without making excuses",
      "paras": [
        "Shame can create another reason to avoid the task. After procrastinating, a person may think they have already failed, which makes returning to the work emotionally harder. Self-compassion means acknowledging the setback without attacking yourself, then choosing a constructive next step. It does not mean pretending that deadlines or consequences do not matter. [1]",
        "A useful review asks what happened: Was the next step unclear? Was the task too large? Did fear of evaluation appear? Was sleep or workload a factor? The answer can guide a practical adjustment. If procrastination is persistent and seriously disrupts work, study or daily life, support from a qualified mental-health professional may help explore contributing factors rather than relying on shame or generic productivity rules. [1][2]"
      ]
    },
    {
      "h2": "When delay is not the problem",
      "paras": [
        "Sometimes the right action is to postpone a task. People need sleep, must respond to emergencies, or discover that a supposed priority is no longer important. Rest can restore attention, and revising a deadline after new information arrives may be responsible planning. The aim is not to eliminate every delay but to distinguish purposeful choices from repeated avoidance that conflicts with your own goals. [1][2]",
        "Procrastination also varies by situation. Someone may start creative work easily but delay administrative tasks, or handle familiar duties while avoiding an uncertain conversation. Look for the conditions that predict the delay rather than assuming a fixed personality trait. A better plan combines realistic workload, clear next steps, emotional awareness and an environment that supports action. [1][3]"
      ]
    }
  ],
  "faq": [
    {
      "q": "Is procrastination the same as laziness?",
      "a": "No. Procrastination describes unnecessary delay despite expecting negative consequences. It can involve emotional avoidance, uncertainty or task design rather than a fixed character flaw. [1][2]"
    },
    {
      "q": "Why do I procrastinate even when a task matters?",
      "a": "Important tasks can trigger anxiety, perfectionism or uncertainty. Avoidance may provide short-term relief, which reinforces delay even while the longer-term consequences become worse. [1]"
    },
    {
      "q": "What is one way to stop procrastinating?",
      "a": "Define one small, concrete action and start for a short, planned interval. Reducing ambiguity and the pressure to finish everything immediately can make beginning easier. [2][3]"
    },
    {
      "q": "Does self-compassion encourage more procrastination?",
      "a": "Self-compassion is not the same as excusing a missed commitment. It means acknowledging a setback without shame and using the information to choose a practical next step. [1]"
    },
    {
      "q": "When should I seek help for procrastination?",
      "a": "If delay persistently disrupts work, study or daily life, a qualified professional may help identify contributing factors and build strategies suited to your circumstances. [1][2]"
    }
  ],
  "sources": [
    {
      "n": 1,
      "title": "Why we procrastinate and what to do about it, with Fuschia Sirois, PhD",
      "publisher": "American Psychological Association",